{
  "schema_version": "0.1.0",
  "artifact_type": "foundational_subject_registry",
  "registry_type": "foundational_subject_registry",
  "entries": [
    {
      "target_type": "FOUNDATIONAL_SUBJECT",
      "subject_kind": "MEMORY_TAXONOMY",
      "subject_id": "LCMRP-FSUBJ-9901-SYNTHETIC-DRY-RUN-TAXONOMY",
      "subject_series": "LCMRP-SYNTHETIC-DRY-RUN-TAXONOMY",
      "subject_version": 1,
      "supersedes_subject_version": null,
      "supersedes_definition_digest": null,
      "entry_status": "ACTIVE",
      "name": "SYNTHETIC-DRY-RUN kind-first and role-first taxonomy comparison",
      "definition": "A constructed comparison subject containing two deliberately competing candidate organizations: Organization K assigns one series-stable primary functional kind, while Organization R assigns contextual, potentially many-valued functional roles.",
      "boundary": "The subject is limited to deterministic serialization of constructed cases. It does not establish category truth, completeness, utility, biological validity, external validity, mechanism effectiveness, or adoption readiness.",
      "definition_artifact": {
        "artifact_id": "ARTIFACT-SYNTHETIC-DRY-RUN-TAXONOMY-SUBJECT",
        "artifact_version": 1,
        "schema_id": "urn:lcmrp:synthetic-dry-run:taxonomy-subject-definition:0.1.0",
        "locator": "examples/m1-dry-runs/taxonomy/definitions/subject-definition.json",
        "digest": {
          "algorithm": "SHA-256",
          "status": "VERIFIED",
          "value": "960e4729ebe96f86073fe2d0230d6ee41dda38564b44998ab4efa93835e12e23",
          "scope": "RAW_FILE_BYTES"
        },
        "media_type": "application/json"
      },
      "research_layer": "LAYER_1_FOUNDATIONAL_RESEARCH",
      "mechanism_maturity_applicability": "NOT_APPLICABLE",
      "registered_at": "2026-07-21T11:59:00Z"
    }
  ]
}
